{
  "type": "https://kgfoundry.dev/problems/configuration-error",
  "title": "Configuration Missing",
  "status": 500,
  "detail": "Environment variable KGFOUNDRY_API_KEY is required but not set",
  "instance": "urn:kgfoundry:settings:load",
  "code": "configuration-error",
  "errors": {
    "env": "KGFOUNDRY_API_KEY",
    "suggested_action": "Set KGFOUNDRY_API_KEY in your environment or .env file"
  }
}

