{
  "type": "https://kgfoundry.dev/problems/search-gpu-unavailable",
  "title": "SearchGpuUnavailableError",
  "status": 503,
  "detail": "GPU resources unavailable; continued with CPU-only FAISS index instead.",
  "code": "search-gpu-unavailable",
  "instance": "/api/v1/search",
  "errors": {
    "gpu_devices": [0, 1],
    "use_cuvs": true,
    "fallback": "cpu",
    "action": "Check FAISS/cuVS installation or disable GPU acceleration"
  }
}
